[
  {
    "id": "fa6feaf4-1202-4263-9e1a-a71a6f43a661",
    "source": "Salvage Union Workshop Manual",
    "name": "Waster Mob",
    "actions": ["Improvised Weapons", "Salvaging Tools (NPC)"],
    "hitPoints": 4,
    "damageType": "HP",
    "page": 300,
    "content": [
      {
        "type": "paragraph",
        "value": "A mob of wastelanders with improvised weapons."
      }
    ]
  },
  {
    "id": "75f5e27f-64d7-4bd1-8f5b-46d38646e092",
    "source": "Salvage Union Workshop Manual",
    "name": "Raider Band",
    "actions": ["Improvised Firearms", "High Tensile Wire (Raider Band)"],
    "hitPoints": 6,
    "damageType": "HP",
    "page": 300,
    "content": [
      {
        "type": "paragraph",
        "value": "A band of raiders hungry for scrap."
      }
    ]
  },
  {
    "id": "dea7128f-1361-43b5-b4d1-9273a38c606b",
    "source": "Salvage Union Workshop Manual",
    "name": "Rifle Squad",
    "actions": ["Rifles", "Portable Comms Unit (NPC)"],
    "hitPoints": 10,
    "damageType": "HP",
    "page": 300,
    "content": [
      {
        "type": "paragraph",
        "value": "A group of grunts armed with rifles."
      }
    ]
  },
  {
    "id": "139b0d61-9739-4c20-8fc3-6bd12ab6c360",
    "source": "Salvage Union Workshop Manual",
    "name": "Machine Gun Squad",
    "actions": [
      ".50 Cal Machine Gun (Machine Gun Squad)",
      "Portable Comms Unit (NPC)",
      "First Aid Kit (NPC)"
    ],
    "hitPoints": 10,
    "damageType": "HP",
    "page": 274,
    "content": [
      {
        "type": "paragraph",
        "value": "Combat trained troops armed with a mobile heavy machine gun."
      }
    ]
  },
  {
    "id": "f2542b86-1982-49da-8906-e5f672511161",
    "source": "Salvage Union Workshop Manual",
    "name": "Missile Squad",
    "actions": [
      "Rocket Launcher (Missile Squad)",
      "Portable Comms Unit (NPC)",
      "First Aid Kit (NPC)"
    ],
    "hitPoints": 10,
    "damageType": "HP",
    "page": 300,
    "content": [
      {
        "type": "paragraph",
        "value": "Combat trained troops armed with a mobile missile launcher."
      }
    ]
  },
  {
    "id": "9a88af6a-b207-443b-a45f-c7cb34262ed7",
    "source": "Salvage Union Workshop Manual",
    "name": "Elite Blade Squad",
    "actions": [
      "Monomolecular Sword (Elite Blade Squad)",
      "Portable Comms Unit (NPC)",
      "Electro Grappling Hook (Elite Blade Squad)"
    ],
    "hitPoints": 20,
    "damageType": "HP",
    "asset_url": "https://opxrguskxuogghzcnppk.supabase.co/storage/v1/object/public/LP-Assets/squads/elite%20beam%20squad.jpg",
    "page": 301,
    "content": [
      {
        "type": "paragraph",
        "value": "Heavy assault troops armed with energised blades."
      }
    ]
  },
  {
    "id": "6fefee71-cbf6-4ce8-ba49-e8dd41c65f8b",
    "source": "Salvage Union Workshop Manual",
    "name": "Elite Beam Squad",
    "actions": [
      "Beta Fission Gun (Elite Beam Squad)",
      "Portable Comms Unit (NPC)",
      "Night Vision Optics"
    ],
    "hitPoints": 20,
    "damageType": "HP",
    "page": 301,
    "content": [
      {
        "type": "paragraph",
        "value": "Apex troops in heavy armour armed with a big ol' gun."
      }
    ]
  },
  {
    "id": "3263b60d-d599-45f8-b2e7-0d5382531bc1",
    "source": "Salvage Union Workshop Manual",
    "name": "Wasteland Herd",
    "actions": ["Stampede"],
    "hitPoints": 4,
    "damageType": "HP",
    "page": 270,
    "content": [
      {
        "type": "paragraph",
        "value": "A herd of wasteland creatures."
      }
    ]
  },
  {
    "id": "99a017d5-5e92-4f3b-8696-7f1f806a0dbc",
    "source": "Salvage Union Workshop Manual",
    "name": "Drone Squadron",
    "actions": ["Red Laser (Drone Squadron)", "Hover Locomotion System (Drone Squadron)"],
    "hitPoints": 8,
    "damageType": "SP",
    "page": 301,
    "content": [
      {
        "type": "paragraph",
        "value": "A swarm of Combat Drones flying in sync."
      }
    ]
  },
  {
    "id": "2c761238-bf2c-4e26-b8b5-4c3d60ba3fd2",
    "name": "Gully Crusher Squad",
    "source": "Rainmaker",
    "page": 79,
    "hitPoints": 8,
    "damageType": "HP",
    "actions": [
      "Machine-Pistols (Gully Crusher Squad)",
      "Outrider Hunters"
    ],
    "content": [
      {
        "type": "paragraph",
        "value": "Trained at fighting other Outriders and bands of troops, their machine pistols rake their foes with hot death."
      }
    ]
  },
  {
    "id": "567f2b23-525b-4774-8206-3486eb1da1b8",
    "name": "Flint Children Squad",
    "source": "Rainmaker",
    "page": 79,
    "hitPoints": 8,
    "damageType": "HP",
    "actions": [
      "Improvised Explosive Device (Flint Children Squad)",
      "Demolition Experts",
      "Minefield"
    ],
    "content": [
      {
        "type": "paragraph",
        "value": "Demolition Experts who lace the area around their territory with homemade explosives."
      }
    ]
  },
  {
    "id": "502ccfd8-8c04-4c4e-a435-53e70f7abfa4",
    "name": "Cuspers Squad",
    "source": "Rainmaker",
    "page": 79,
    "hitPoints": 6,
    "damageType": "HP",
    "actions": [
      "Epoxy Guns (Cuspers Squad)",
      "Hit & Run"
    ],
    "content": [
      {
        "type": "paragraph",
        "value": "Expert hit and run riders who carry epoxy weapons that seal the exhaust ports of Mechs causing them to overload."
      }
    ]
  },
  {
    "id": "64ee7ad5-e45c-4339-b106-e9c4af860ac5",
    "name": "Fell Stalkers Squad",
    "source": "Rainmaker",
    "page": 79,
    "hitPoints": 8,
    "damageType": "HP",
    "actions": [
      "Fell Rifles (Fell Stalkers Squad)",
      "Thermal Goggles",
      "Born in the Saddle"
    ],
    "content": [
      {
        "type": "paragraph",
        "value": "Sharpshooters who can ride into a maelstrom of fire and come out unscathed."
      }
    ]
  },
  {
    "id": "740cbf45-6074-4d85-a504-de26495497c9",
    "name": "Free Hill Coalition Squad",
    "source": "Rainmaker",
    "page": 79,
    "hitPoints": 10,
    "damageType": "HP",
    "actions": [
      "Rebar Lances (Free Hill Coalition Squad)",
      "Servo-Lasso (Free Hill Coalition Squad)"
    ],
    "content": [
      {
        "type": "paragraph",
        "value": "Daring riders who pin targets with servo-lassos and then skewer them with their lances."
      }
    ]
  }
]
